{
	"$schema": "../skills/design-config/json-schemas/current.json",
	"integration": {
		"ci": {
			"enabled": false,
			"syncOnMerge": false,
			"validateOnPR": false
		},
		"git": {
			"requireReviewForChanges": false,
			"trackDesignDocs": true
		},
		"plans": {
			"autoSyncProgress": false,
			"bidirectionalLinking": true,
			"cacheMetadata": true,
			"cacheTTL": 300,
			"enabled": true,
			"validateOnCommit": true
		}
	},
	"modules": {
		"claude-coordinator-core": {
			"categories": ["architecture", "integration"],
			"designDocsPath": ".claude/design/claude-coordinator-core",
			"maintainer": "C. Spencer Beggs",
			"path": "pkgs/claude-coordinator-core",
			"userDocs": {
				"readme": "pkgs/claude-coordinator-core/README.md",
				"repoDocs": null,
				"siteDocs": null
			}
		},
		"claude-coordinator-mcp": {
			"categories": ["architecture", "integration"],
			"designDocsPath": ".claude/design/claude-coordinator-mcp",
			"maintainer": "C. Spencer Beggs",
			"path": "pkgs/claude-coordinator-mcp",
			"userDocs": {
				"readme": "pkgs/claude-coordinator-mcp/README.md",
				"repoDocs": null,
				"siteDocs": null
			}
		},
		"claude-coordinator-server": {
			"categories": ["architecture", "integration", "observability"],
			"designDocsPath": ".claude/design/claude-coordinator-server",
			"maintainer": "C. Spencer Beggs",
			"path": "pkgs/claude-coordinator-server",
			"userDocs": {
				"readme": "pkgs/claude-coordinator-server/README.md",
				"repoDocs": null,
				"siteDocs": null
			}
		}
	},
	"paths": {
		"context": "CLAUDE.md",
		"designDocs": ".claude/design",
		"localContext": "CLAUDE.local.md",
		"plans": ".claude/plans",
		"skills": ".claude/skills"
	},
	"project": {
		"maintainer": "C. Spencer Beggs",
		"name": "spencerbeggs/claude-design-coordinator",
		"repository": "https://github.com/spencerbeggs/claude-design-coordinator",
		"type": "monorepo"
	},
	"quality": {
		"context": {
			"childMaxLines": 300,
			"requireDesignDocPointers": true,
			"rootMaxLines": 500
		},
		"designDocs": {
			"maxLineLength": 120,
			"minSections": ["Overview", "Current State", "Rationale"],
			"requireFrontmatter": true,
			"requireTOC": true
		},
		"plans": {
			"archiveAfterDays": 30,
			"maxLineLength": 120,
			"progressRange": [0, 100],
			"requiredFields": ["name", "title", "created", "status", "progress"],
			"requireFrontmatter": true,
			"stalenessThresholdDays": 30,
			"validStatuses": ["ready", "in-progress", "blocked", "completed", "abandoned"]
		},
		"userDocs": {
			"level1": {
				"maxLineLength": 80,
				"requireSections": ["Features", "Installation", "Usage"],
				"targetWordCount": [200, 500]
			},
			"level2": {
				"maxLineLength": 120,
				"requireNavigation": true
			},
			"level3": {
				"framework": "rspress",
				"requireCodeExamples": true,
				"requireMetadata": true
			}
		}
	},
	"skills": {
		"baseNamespace": "/",
		"enabled": [
			"design-init",
			"design-validate",
			"design-update",
			"design-sync",
			"design-review",
			"design-audit",
			"design-config",
			"context-validate",
			"context-review",
			"context-update",
			"plan-create",
			"plan-validate",
			"plan-list",
			"plan-explore",
			"plan-complete"
		]
	},
	"version": "1.0.0"
}
